<?xml version="1.0" encoding="UTF-8"?>
<csd:driver 
	xmlns="-//org.witerat/cafenated/sql"
	xmlns:xsi="http://www.w3.org/2001/XMLSchema-instance"
	xmlns:csd="-//org.witerat/cafenated/sql"
	xsi:schemaLocation="-//org.witerat/cafenated/sql schemas/cafenated.xsd">
	
	<meta name="H2-Database" 
		protocol="jdbc:h2:" 
		description="H2 pure java DB"
		className="org.h2.Driver"		/>
	<template-engine>velocity</template-engine>
	<def name="params">
		#foreach($key in ${params.keys})#{set($value =
		$params[$key])};${key}=$!{value}#{end}
	</def>
	<dialect id="h2">
		<grammar name="ddl-common">
			<noun name="Schema">
				<param name="schema" type='string'></param>
				<verb name="create">
					<param name="whenMissing" type="boolean"></param>
					CREATE SCHEMA #if($!whenMissing) IF NOT EXISTS#{end}
					${dialect.renderId($schema)};
				</verb>
				<verb name="drop">
					<param name="whenPresent" type="boolean"></param>
					DROP SCHEMA #if($!whenPresent) IF EXISTS#{end}
					${dialect.renderId($schema)};
				</verb>
			</noun>
			<noun name="sequence">
				<param name="sequenceName"></param>
				<verb name="drop">
					<param name="whenPresent" type="boolean"></param>
					DROP SCHEMA #if($!whenPresent) IF EXISTS#{end}
					${dialect.renderId($sequenceName)};
				</verb>
			</noun>
			<noun name="user">
				<param name="userName" type="string" />

				<verb name="create">
					<param name="whenMissing" type="boolean"></param>
					<param name="password" type="string"></param>
					<param name="salt" type="string"></param>
					<param name="hash" type="string"></param>
					CREATE USER #if($!whenMissing) IF NOT EXISTS#{end}
					${dialect.renderId($userName)}
					#if($!password)
					$dialect.renderString($password)
					#elseif SALT $salt HASH $hash#end
					#if(isAdmin) ADMIN#end
				</verb>
				<verb name='drop'>
					<param name="whenPresent" type="boolean"></param>
					DROP USER #if($!whenPresent) IF EXISTS#{end}
					$dialect.renderId(userName)
				</verb>
			</noun>
		</grammar>
	</dialect>
	<connection method="memory">
		<use-dialect name="$mode" default='h2' />
		<url>
			jdbc:h2:mem:
			<use macro="params" />
		</url>
	</connection>
	<connection method="memory-shared">
		<use-dialect name="$mode" default='h2' />
		<url>
			jdbc:h2:mem:$dbname
			<use macro="params" />
		</url>
	</connection>
	<connection method="disk">
		<use-dialect name="$mode" default='h2' />
		<url>
			jdbc:h2:file:$!{path}${dbName}
			<use macro="params" />
		</url>
	</connection>
	<connection method="zip">
		<use-dialect name="$mode" default='h2' />
		<url>
			jdbc:h2:zip:$!{path}!${dbName}
			<use macro="params" />
		</url>
	</connection>
	<connection method="secure-server">
		<use-dialect name="$mode" default='h2' />
		<url>jdbc:h2:ssl://${host}#if(port):$port#{end};user="$userName",password="$password"
			<use macro="params" />
		</url>
	</connection>
	<connection method="server">
		<use-dialect name="$mode" default='h2' />
		<url>jdbc:h2:tcp://${host}#if(port):$port#{end};user="$userName",password="$password"
		</url>
	</connection>
	<connection method="server-memory">
		<use-dialect name="$mode" default='h2' />
		<url>jdbc:h2:$host/mem:${dbname};<use macro="params" /></url>
	</connection>
</csd:driver>